{
  "date": "2026-10-16",
  "batch": 4,
  "of": 4,
  "clusters": [],
  "items": [
    {
      "id": "a3f7cd60d423bf9c31ecaa45105b8bd27ffa3f68",
      "title": "How Windows is being optimized for Nvidia’s RTX Spark laptops",
      "source": "The Verge: AI",
      "sourceTier": 2,
      "url": "https://www.theverge.com/tech/1011996/microsoft-windows-rtx-spark-platform-changes-notepad",
      "author": "Tom Warren",
      "publishedAt": "2026-10-15T14:30:00Z",
      "categoryHint": "News",
      "signals": {
        "hnPoints": null,
        "hnComments": null,
        "redditScore": null,
        "githubStars": null,
        "githubStarsDelta": null,
        "crossSourceCount": 1
      },
      "trendDelta": 1,
      "trendBaseline": 1,
      "previouslyFeatured": false,
      "clusterId": null,
      "clusterLabel": null
    },
    {
      "id": "8328bf79bca4f01fc127a0c503a25a602bd51d38",
      "title": "What OpenAI’s 719 Math Papers Mean for Data Science",
      "source": "Towards Data Science",
      "sourceTier": 2,
      "url": "https://towardsdatascience.com/what-openais-719-math-papers-mean-for-data-science/",
      "author": "Sean Moran",
      "publishedAt": "2026-10-15T14:00:00Z",
      "categoryHint": "Tutorials",
      "signals": {
        "hnPoints": null,
        "hnComments": null,
        "redditScore": null,
        "githubStars": null,
        "githubStarsDelta": null,
        "crossSourceCount": 1
      },
      "trendDelta": null,
      "trendBaseline": 0,
      "previouslyFeatured": false,
      "clusterId": null,
      "clusterLabel": null
    },
    {
      "id": "40b611a330c7478c028f8a5cac8062e80ead7ceb",
      "title": "Anthropic tells investors quarterly revenue up nearly 50% to $16.8bn ahead of IPO",
      "source": "Simon Willison",
      "sourceTier": 2,
      "url": "https://simonwillison.net/2026/Oct/15/anthropic-tells-investors/",
      "author": null,
      "publishedAt": "2026-10-15T13:04:03Z",
      "categoryHint": "Opinion",
      "signals": {
        "hnPoints": null,
        "hnComments": null,
        "redditScore": null,
        "githubStars": null,
        "githubStarsDelta": null,
        "crossSourceCount": 1
      },
      "trendDelta": 1,
      "trendBaseline": 1,
      "previouslyFeatured": false,
      "clusterId": null,
      "clusterLabel": null
    },
    {
      "id": "9b7714f40f9b481d4f7bc9f42ed10ad451e95000",
      "title": "How Many Guesses Does It Take to Crack an AI's \"Random\" Number?",
      "source": "Towards Data Science",
      "sourceTier": 2,
      "url": "https://towardsdatascience.com/how-many-guesses-does-it-take-to-crack-an-ais-random-number/",
      "author": "Utkarsh Mangal",
      "publishedAt": "2026-10-15T12:30:00Z",
      "categoryHint": "Tutorials",
      "signals": {
        "hnPoints": null,
        "hnComments": null,
        "redditScore": null,
        "githubStars": null,
        "githubStarsDelta": null,
        "crossSourceCount": 1
      },
      "trendDelta": null,
      "trendBaseline": 0,
      "previouslyFeatured": false,
      "clusterId": null,
      "clusterLabel": null
    },
    {
      "id": "9a556c5d266337a7ea3504a5e3314cf33758c64a",
      "title": "AI #190: Scion of the Times",
      "source": "Don't Worry About the Vase (Zvi)",
      "sourceTier": 2,
      "url": "https://thezvi.substack.com/p/ai-190-scion-of-the-times",
      "author": "Zvi Mowshowitz",
      "publishedAt": "2026-10-15T12:03:51Z",
      "categoryHint": "Opinion",
      "signals": {
        "hnPoints": null,
        "hnComments": null,
        "redditScore": null,
        "githubStars": null,
        "githubStarsDelta": null,
        "crossSourceCount": 1
      },
      "trendDelta": 1,
      "trendBaseline": 1,
      "previouslyFeatured": false,
      "clusterId": null,
      "clusterLabel": null
    },
    {
      "id": "24c7389afe46c47b5b192f9b8ca54edbaf5da595",
      "title": "I Tested Four Ways to Give an AI Assistant a Memory. The Obvious One Was the Worst Value.",
      "source": "Towards Data Science",
      "sourceTier": 2,
      "url": "https://towardsdatascience.com/i-tested-four-ways-to-give-an-ai-assistant-a-memory-the-obvious-one-was-the-worst-value/",
      "author": "Abdullahi Dattijo",
      "publishedAt": "2026-10-15T11:00:00Z",
      "categoryHint": "Tutorials",
      "signals": {
        "hnPoints": null,
        "hnComments": null,
        "redditScore": null,
        "githubStars": null,
        "githubStarsDelta": null,
        "crossSourceCount": 1
      },
      "trendDelta": null,
      "trendBaseline": 0,
      "previouslyFeatured": false,
      "clusterId": null,
      "clusterLabel": null
    },
    {
      "id": "54389908e07ca0097275af423ca66f1dc6d17189",
      "title": "Choosing a Chunking Strategy for Your LLM Apps: A Decision-Tree Approach",
      "source": "Machine Learning Mastery",
      "sourceTier": 2,
      "url": "https://machinelearningmastery.com/choosing-a-chunking-strategy-for-your-llm-apps-a-decision-tree-approach/",
      "author": "Bala Priya C",
      "publishedAt": "2026-10-15T11:00:00Z",
      "categoryHint": "Tutorials",
      "signals": {
        "hnPoints": null,
        "hnComments": null,
        "redditScore": null,
        "githubStars": null,
        "githubStarsDelta": null,
        "crossSourceCount": 1
      },
      "trendDelta": null,
      "trendBaseline": 0,
      "previouslyFeatured": false,
      "clusterId": null,
      "clusterLabel": null
    },
    {
      "id": "b2481d1228ebf07d1a1828c9647afc9b8e62ddbe",
      "title": "Mindcare",
      "source": "More Better Thinking",
      "sourceTier": 2,
      "url": "https://morebetterthinking.substack.com/p/mindcare",
      "author": "William B. Irvine",
      "publishedAt": "2026-10-15T10:11:51Z",
      "categoryHint": "Opinion",
      "signals": {
        "hnPoints": null,
        "hnComments": null,
        "redditScore": null,
        "githubStars": null,
        "githubStarsDelta": null,
        "crossSourceCount": 1
      },
      "trendDelta": null,
      "trendBaseline": 0,
      "previouslyFeatured": false,
      "clusterId": null,
      "clusterLabel": null
    },
    {
      "id": "7908d899cb3e3fcc9a4b43b847f9c3f2a54fd87f",
      "title": "[AINews] Modal’s $1B ARR, $16B Series D makes it NYC’s newest AI Infra Decacorn, 3x usage and 3x valuation in 5 months, 15x in 1 yr",
      "source": "Latent Space",
      "sourceTier": 2,
      "url": "https://www.latent.space/p/ainews-modals-1b-arr-16b-series-d",
      "author": null,
      "publishedAt": "2026-10-15T10:08:08Z",
      "categoryHint": "News",
      "signals": {
        "hnPoints": null,
        "hnComments": null,
        "redditScore": null,
        "githubStars": null,
        "githubStarsDelta": null,
        "crossSourceCount": 1
      },
      "trendDelta": 1,
      "trendBaseline": 1,
      "previouslyFeatured": false,
      "clusterId": null,
      "clusterLabel": null
    },
    {
      "id": "0d594a83b91f9e717449d3b4b27c84b22ab122df",
      "title": "How to Design a Good MCP Server 🔌",
      "source": "Refactoring (Luca Rossi)",
      "sourceTier": 2,
      "url": "https://refactoring.fm/p/how-to-design-a-good-mcp-server",
      "author": "Luca Rossi",
      "publishedAt": "2026-10-15T08:06:06Z",
      "categoryHint": "Tutorials",
      "signals": {
        "hnPoints": null,
        "hnComments": null,
        "redditScore": null,
        "githubStars": null,
        "githubStarsDelta": null,
        "crossSourceCount": 1
      },
      "trendDelta": 0.86,
      "trendBaseline": 1,
      "previouslyFeatured": false,
      "clusterId": null,
      "clusterLabel": null
    },
    {
      "id": "ca03053b4e7ebd827ff3d8ea8841008e69147151",
      "title": "Generative AI in disarray",
      "source": "Marcus on AI",
      "sourceTier": 2,
      "url": "https://garymarcus.substack.com/p/generative-ai-in-disarray",
      "author": "Gary Marcus",
      "publishedAt": "2026-10-15T01:32:36Z",
      "categoryHint": "Opinion",
      "signals": {
        "hnPoints": null,
        "hnComments": null,
        "redditScore": null,
        "githubStars": null,
        "githubStarsDelta": null,
        "crossSourceCount": 1
      },
      "trendDelta": null,
      "trendBaseline": 0,
      "previouslyFeatured": false,
      "clusterId": null,
      "clusterLabel": null
    },
    {
      "id": "c6a3287a8503a205cf116b498798e7e601f25a1d",
      "title": "The states come for OpenAI",
      "source": "Platformer (Casey Newton)",
      "sourceTier": 2,
      "url": "https://www.platformer.news/openai-states-lawsuit-liability/",
      "author": "Casey Newton",
      "publishedAt": "2026-10-15T00:52:13Z",
      "categoryHint": "News",
      "signals": {
        "hnPoints": null,
        "hnComments": null,
        "redditScore": null,
        "githubStars": null,
        "githubStarsDelta": null,
        "crossSourceCount": 1
      },
      "trendDelta": null,
      "trendBaseline": 0,
      "previouslyFeatured": false,
      "clusterId": null,
      "clusterLabel": null
    },
    {
      "id": "8fbb1278b1546649968491ef730cfd01de125809",
      "title": "Jev 1.14 ⚡, Grok Voice 3 🎙️, RSI 🔁",
      "source": "TLDR AI",
      "sourceTier": 2,
      "url": "https://tldr.tech/ai/2026-10-15",
      "author": "TLDR",
      "publishedAt": "2026-10-15T00:00:00Z",
      "categoryHint": "News",
      "signals": {
        "hnPoints": null,
        "hnComments": null,
        "redditScore": null,
        "githubStars": null,
        "githubStarsDelta": null,
        "crossSourceCount": 1
      },
      "trendDelta": 1,
      "trendBaseline": 1,
      "previouslyFeatured": false,
      "clusterId": null,
      "clusterLabel": null
    }
  ]
}
