{
  "date": "2026-10-30",
  "batch": 4,
  "of": 4,
  "clusters": [],
  "items": [
    {
      "id": "22a42169ff916c20cde5cf42612e16862d8b2383",
      "title": "Software engineering at Google & CS education with Titus Winters",
      "source": "The Pragmatic Engineer",
      "sourceTier": 2,
      "url": "https://newsletter.pragmaticengineer.com/p/software-engineering-at-google-and",
      "author": "Gergely Orosz",
      "publishedAt": "2026-10-29T13:37:13Z",
      "categoryHint": "Tutorials",
      "signals": {
        "hnPoints": null,
        "hnComments": null,
        "redditScore": null,
        "githubStars": null,
        "githubStarsDelta": null,
        "crossSourceCount": 1
      },
      "trendDelta": 1,
      "trendBaseline": 1,
      "previouslyFeatured": false,
      "clusterId": null,
      "clusterLabel": null
    },
    {
      "id": "9af57b5f5723b3fc41c28bd503657f3c53055c93",
      "title": "What actually is AI research? (Technically Speaking, Ep 2)",
      "source": "Technically",
      "sourceTier": 2,
      "url": "https://read.technically.dev/p/what-actually-is-ai-research-technically",
      "author": "Megan Reynolds",
      "publishedAt": "2026-10-29T13:31:25Z",
      "categoryHint": "Tutorials",
      "signals": {
        "hnPoints": null,
        "hnComments": null,
        "redditScore": null,
        "githubStars": null,
        "githubStarsDelta": null,
        "crossSourceCount": 1
      },
      "trendDelta": 0.86,
      "trendBaseline": 1,
      "previouslyFeatured": false,
      "clusterId": null,
      "clusterLabel": null
    },
    {
      "id": "113fb4594f86cc3db07639f769f34bf835e79832",
      "title": "Anthropic’s business plan: Build God or die trying",
      "source": "The Verge: AI",
      "sourceTier": 2,
      "url": "https://www.theverge.com/ai-artificial-intelligence/1021476/anthropic-s-1-compute-recursive",
      "author": "Elizabeth Lopatto",
      "publishedAt": "2026-10-29T13:30:00Z",
      "categoryHint": "News",
      "signals": {
        "hnPoints": null,
        "hnComments": null,
        "redditScore": null,
        "githubStars": null,
        "githubStarsDelta": null,
        "crossSourceCount": 1
      },
      "trendDelta": 1,
      "trendBaseline": 1,
      "previouslyFeatured": false,
      "clusterId": null,
      "clusterLabel": null
    },
    {
      "id": "0aab88e24825247c8690953062351915019fd8c4",
      "title": "New Study: Anthropic Just Gave You a Reason to Stop Working With AI",
      "source": "The Algorithmic Bridge",
      "sourceTier": 2,
      "url": "https://www.thealgorithmicbridge.com/p/new-study-anthropic-just-gave-you",
      "author": "Alberto Romero",
      "publishedAt": "2026-10-29T13:20:35Z",
      "categoryHint": "Opinion",
      "signals": {
        "hnPoints": null,
        "hnComments": null,
        "redditScore": null,
        "githubStars": null,
        "githubStarsDelta": null,
        "crossSourceCount": 1
      },
      "trendDelta": null,
      "trendBaseline": 0,
      "previouslyFeatured": false,
      "clusterId": null,
      "clusterLabel": null
    },
    {
      "id": "e021545b06e5431d31b74e10b0838f79ac1b5b99",
      "title": "Is the #1 AI Model Really #1?",
      "source": "Towards Data Science",
      "sourceTier": 2,
      "url": "https://towardsdatascience.com/is-the-1-ai-model-really-1/",
      "author": "Utkarsh Mangal",
      "publishedAt": "2026-10-29T12:30:00Z",
      "categoryHint": "Tutorials",
      "signals": {
        "hnPoints": null,
        "hnComments": null,
        "redditScore": null,
        "githubStars": null,
        "githubStarsDelta": null,
        "crossSourceCount": 1
      },
      "trendDelta": 1,
      "trendBaseline": 1,
      "previouslyFeatured": false,
      "clusterId": null,
      "clusterLabel": null
    },
    {
      "id": "16013b06c3c03f95091ef2a80f83d2abf663c5e9",
      "title": "What Is Harness Engineering? A Hands-On Introduction",
      "source": "Towards Data Science",
      "sourceTier": 2,
      "url": "https://towardsdatascience.com/what-is-harness-engineering-a-hands-on-introduction/",
      "author": "Sam Black",
      "publishedAt": "2026-10-29T11:00:00Z",
      "categoryHint": "Tutorials",
      "signals": {
        "hnPoints": null,
        "hnComments": null,
        "redditScore": null,
        "githubStars": null,
        "githubStarsDelta": null,
        "crossSourceCount": 1
      },
      "trendDelta": null,
      "trendBaseline": 0,
      "previouslyFeatured": false,
      "clusterId": null,
      "clusterLabel": null
    },
    {
      "id": "0c49eb4fc30298f014f2732cdf1ea4427e4dbec2",
      "title": "We urgently need to monitor AI agents’ actions in real time",
      "source": "MIT Technology Review: AI",
      "sourceTier": 2,
      "url": "https://www.technologyreview.com/2026/10/29/1147824/monitor-ai-agents-actions-real-time/",
      "author": "Madhulika Srikumar, Claire Leibowicz",
      "publishedAt": "2026-10-29T10:11:12Z",
      "categoryHint": "News",
      "signals": {
        "hnPoints": null,
        "hnComments": null,
        "redditScore": null,
        "githubStars": null,
        "githubStarsDelta": null,
        "crossSourceCount": 1
      },
      "trendDelta": null,
      "trendBaseline": 0,
      "previouslyFeatured": false,
      "clusterId": null,
      "clusterLabel": null
    },
    {
      "id": "697824f502d27faf87a81d7095c1f96bea453a01",
      "title": "AI has come for Arizona’s water",
      "source": "The Verge: AI",
      "sourceTier": 2,
      "url": "https://www.theverge.com/cs/features/1016650/arizona-water-data-center-tsmc",
      "author": "Gaby Del Valle",
      "publishedAt": "2026-10-29T10:00:04Z",
      "categoryHint": "News",
      "signals": {
        "hnPoints": null,
        "hnComments": null,
        "redditScore": null,
        "githubStars": null,
        "githubStarsDelta": null,
        "crossSourceCount": 1
      },
      "trendDelta": null,
      "trendBaseline": 0,
      "previouslyFeatured": false,
      "clusterId": null,
      "clusterLabel": null
    },
    {
      "id": "ed230ac810bddf59e09d3ab2c03eaeaaddefa782",
      "title": "I Gave My Blood to the AI Death Clock",
      "source": "WIRED: AI",
      "sourceTier": 2,
      "url": "https://www.wired.com/story/i-gave-an-ai-death-clock-my-blood/",
      "author": "Jason Parham",
      "publishedAt": "2026-10-29T10:00:00Z",
      "categoryHint": "News",
      "signals": {
        "hnPoints": null,
        "hnComments": null,
        "redditScore": null,
        "githubStars": null,
        "githubStarsDelta": null,
        "crossSourceCount": 1
      },
      "trendDelta": null,
      "trendBaseline": 0,
      "previouslyFeatured": false,
      "clusterId": null,
      "clusterLabel": null
    },
    {
      "id": "7df6a06689af67fd18aed6817d1f843a255a812a",
      "title": "Are You Changing Your Mind Often Enough?",
      "source": "More Better Thinking",
      "sourceTier": 2,
      "url": "https://morebetterthinking.substack.com/p/are-you-changing-your-mind-often-605",
      "author": "William B. Irvine",
      "publishedAt": "2026-10-29T08:33:26Z",
      "categoryHint": "Opinion",
      "signals": {
        "hnPoints": null,
        "hnComments": null,
        "redditScore": null,
        "githubStars": null,
        "githubStarsDelta": null,
        "crossSourceCount": 1
      },
      "trendDelta": null,
      "trendBaseline": 0,
      "previouslyFeatured": false,
      "clusterId": null,
      "clusterLabel": null
    },
    {
      "id": "52ced88a57d975486cb59c4279c5407e6a979fc2",
      "title": "Quoting Ted Sanders",
      "source": "Simon Willison",
      "sourceTier": 2,
      "url": "https://simonwillison.net/2026/Oct/28/ted-sanders/",
      "author": null,
      "publishedAt": "2026-10-28T23:23:21Z",
      "categoryHint": "Opinion",
      "signals": {
        "hnPoints": null,
        "hnComments": null,
        "redditScore": null,
        "githubStars": null,
        "githubStarsDelta": null,
        "crossSourceCount": 1
      },
      "trendDelta": 0.86,
      "trendBaseline": 1,
      "previouslyFeatured": false,
      "clusterId": null,
      "clusterLabel": null
    },
    {
      "id": "6e4063072a87ded33da7a638279fc855e41c99a4",
      "title": "Adam Mosseri says negativity around AI is ‘going to get worse’",
      "source": "The Verge: AI",
      "sourceTier": 2,
      "url": "https://www.theverge.com/ai-artificial-intelligence/1021644/adam-mosseri-instagram-ai-negativity",
      "author": "Stevie Bonifield",
      "publishedAt": "2026-10-28T23:05:39Z",
      "categoryHint": "News",
      "signals": {
        "hnPoints": null,
        "hnComments": null,
        "redditScore": null,
        "githubStars": null,
        "githubStarsDelta": null,
        "crossSourceCount": 1
      },
      "trendDelta": null,
      "trendBaseline": 0,
      "previouslyFeatured": false,
      "clusterId": null,
      "clusterLabel": null
    }
  ]
}
