{
  "date": "2026-10-09",
  "batch": 4,
  "of": 4,
  "clusters": [],
  "items": [
    {
      "id": "4f5d65c153d21a16a2f549b5cdba9eb9c24ab963",
      "title": "Understanding Jev, the new model everyone is talking about",
      "source": "Understanding AI (Timothy B. Lee)",
      "sourceTier": 2,
      "url": "https://www.understandingai.org/p/understanding-jev-the-new-model-everyone",
      "author": "Kai Williams",
      "publishedAt": "2026-10-08T13:14:53Z",
      "categoryHint": "News",
      "signals": {
        "hnPoints": null,
        "hnComments": null,
        "redditScore": null,
        "githubStars": null,
        "githubStarsDelta": null,
        "crossSourceCount": 1
      },
      "trendDelta": null,
      "trendBaseline": 0,
      "previouslyFeatured": false,
      "clusterId": null,
      "clusterLabel": null
    },
    {
      "id": "46f61f655ab05af5276b0e6c7ca07b15dc0912cc",
      "title": "Building Spyre as a Native PyTorch Device",
      "source": "PyTorch Blog",
      "sourceTier": 2,
      "url": "https://pytorch.org/blog/building-spyre-as-a-native-pytorch-device/",
      "author": "Joshua Rosenkranz, Tuan Hoang Trong, Thomas Gooding, Matthew Pisano, and the IBM Spyre Team",
      "publishedAt": "2026-10-08T12:45:49Z",
      "categoryHint": "Tools & Releases",
      "signals": {
        "hnPoints": null,
        "hnComments": null,
        "redditScore": null,
        "githubStars": null,
        "githubStarsDelta": null,
        "crossSourceCount": 1
      },
      "trendDelta": null,
      "trendBaseline": 0,
      "previouslyFeatured": false,
      "clusterId": null,
      "clusterLabel": null
    },
    {
      "id": "eb655f0448a251c07475249aa8b07952fbc2a556",
      "title": "Your Model's MSE Is Lying to You III: Time Series Diffusion",
      "source": "Towards Data Science",
      "sourceTier": 2,
      "url": "https://towardsdatascience.com/your-models-mse-is-lying-to-you-iii-time-series-diffusion/",
      "author": "Waleed Esmail",
      "publishedAt": "2026-10-08T12:30:00Z",
      "categoryHint": "Tutorials",
      "signals": {
        "hnPoints": null,
        "hnComments": null,
        "redditScore": null,
        "githubStars": null,
        "githubStarsDelta": null,
        "crossSourceCount": 1
      },
      "trendDelta": 1,
      "trendBaseline": 1,
      "previouslyFeatured": false,
      "clusterId": null,
      "clusterLabel": null
    },
    {
      "id": "1c4a47cba4b1745d262cbdb153075f756f2a3b2b",
      "title": "Yelp, who? 4 ways Google Maps can help you find your next meal – and order it",
      "source": "ZDNET: AI",
      "sourceTier": 2,
      "url": "https://www.zdnet.com/tech/google-maps-features-restaurants-dining-food-ordering/",
      "author": "Jada Jones",
      "publishedAt": "2026-10-08T12:00:07Z",
      "categoryHint": "News",
      "signals": {
        "hnPoints": null,
        "hnComments": null,
        "redditScore": null,
        "githubStars": null,
        "githubStarsDelta": null,
        "crossSourceCount": 1
      },
      "trendDelta": 1,
      "trendBaseline": 1,
      "previouslyFeatured": false,
      "clusterId": null,
      "clusterLabel": null
    },
    {
      "id": "95abd2184698e3b946272efc58902358fbdd134f",
      "title": "Nvidia's big bet on physical AI aims for safer robotaxis, humanoid robots",
      "source": "Ars Technica: AI",
      "sourceTier": 2,
      "url": "https://arstechnica.com/ai/2026/10/nvidias-big-bet-on-physical-ai-aims-for-safer-robotaxis-humanoid-robots/",
      "author": "Jeremy Hsu",
      "publishedAt": "2026-10-08T11:15:33Z",
      "categoryHint": "News",
      "signals": {
        "hnPoints": null,
        "hnComments": null,
        "redditScore": null,
        "githubStars": null,
        "githubStarsDelta": null,
        "crossSourceCount": 1
      },
      "trendDelta": null,
      "trendBaseline": 0,
      "previouslyFeatured": false,
      "clusterId": null,
      "clusterLabel": null
    },
    {
      "id": "76fed4269e2f3e28a40f76f39f869cbc8aec5939",
      "title": "AI Engineers, Applied Scientists, Forward Deployed Engineers: Let's Unpack.",
      "source": "Towards Data Science",
      "sourceTier": 2,
      "url": "https://towardsdatascience.com/ai-engineers-applied-scientists-forward-deployed-engineers-lets-unpack/",
      "author": "Piero Paialunga",
      "publishedAt": "2026-10-08T11:00:00Z",
      "categoryHint": "Tutorials",
      "signals": {
        "hnPoints": null,
        "hnComments": null,
        "redditScore": null,
        "githubStars": null,
        "githubStarsDelta": null,
        "crossSourceCount": 1
      },
      "trendDelta": null,
      "trendBaseline": 0,
      "previouslyFeatured": false,
      "clusterId": null,
      "clusterLabel": null
    },
    {
      "id": "d565071e20b31c554d234cbcc54afac053e85ea7",
      "title": "Is Morality Relative?",
      "source": "More Better Thinking",
      "sourceTier": 2,
      "url": "https://morebetterthinking.substack.com/p/is-morality-relative",
      "author": "William B. Irvine",
      "publishedAt": "2026-10-08T10:55:35Z",
      "categoryHint": "Opinion",
      "signals": {
        "hnPoints": null,
        "hnComments": null,
        "redditScore": null,
        "githubStars": null,
        "githubStarsDelta": null,
        "crossSourceCount": 1
      },
      "trendDelta": 0,
      "trendBaseline": 0,
      "previouslyFeatured": false,
      "clusterId": null,
      "clusterLabel": null
    },
    {
      "id": "57b3dda6739c146e1e3f3c7662ae3a9f7c5a2f4e",
      "title": "Tristan Harris’ Tech Nonprofit Is Laying Off Most Staff and Going ‘Founder-Led’",
      "source": "WIRED: AI",
      "sourceTier": 2,
      "url": "https://www.wired.com/story/tristan-harris-tech-nonprofit-is-laying-off-most-staff-and-going-founder-led/",
      "author": "Paresh Dave",
      "publishedAt": "2026-10-08T09:30:00Z",
      "categoryHint": "News",
      "signals": {
        "hnPoints": null,
        "hnComments": null,
        "redditScore": null,
        "githubStars": null,
        "githubStarsDelta": null,
        "crossSourceCount": 1
      },
      "trendDelta": null,
      "trendBaseline": 0,
      "previouslyFeatured": false,
      "clusterId": null,
      "clusterLabel": null
    },
    {
      "id": "c7f4b559a8fbb05c3f5d13a2a3368a40b1c98974",
      "title": "AI breakthroughs in robotics won’t change your life any time soon",
      "source": "MIT Technology Review: AI",
      "sourceTier": 2,
      "url": "https://www.technologyreview.com/2026/10/08/1145923/ai-breakthroughs-in-robotics-wont-change-your-life-any-time-soon/",
      "author": "Jamie Condliffe",
      "publishedAt": "2026-10-08T09:00:00Z",
      "categoryHint": "News",
      "signals": {
        "hnPoints": null,
        "hnComments": null,
        "redditScore": null,
        "githubStars": null,
        "githubStarsDelta": null,
        "crossSourceCount": 1
      },
      "trendDelta": null,
      "trendBaseline": 0,
      "previouslyFeatured": false,
      "clusterId": null,
      "clusterLabel": null
    },
    {
      "id": "e09a47f5417a68b700a12da5a772662137eb7a69",
      "title": "Building a safer path to autonomous industrial AI",
      "source": "MIT Technology Review: AI",
      "sourceTier": 2,
      "url": "https://www.technologyreview.com/2026/10/08/1144020/building-a-safer-path-to-autonomous-industrial-ai/",
      "author": "MIT Technology Review Insights",
      "publishedAt": "2026-10-08T08:17:32Z",
      "categoryHint": "News",
      "signals": {
        "hnPoints": null,
        "hnComments": null,
        "redditScore": null,
        "githubStars": null,
        "githubStarsDelta": null,
        "crossSourceCount": 1
      },
      "trendDelta": null,
      "trendBaseline": 0,
      "previouslyFeatured": false,
      "clusterId": null,
      "clusterLabel": null
    },
    {
      "id": "c2ef578a4730e99d2b0e17dd9f1731a7a01a073d",
      "title": "Microsoft’s new Surface Laptop Ultra finally has a starting price (you should sit down)",
      "source": "ZDNET: AI",
      "sourceTier": 2,
      "url": "https://www.zdnet.com/tech/microsoft-surface-laptop-ultra-preorder-starting-price/",
      "author": "Kyle Kucharski",
      "publishedAt": "2026-10-08T04:21:00Z",
      "categoryHint": "News",
      "signals": {
        "hnPoints": null,
        "hnComments": null,
        "redditScore": null,
        "githubStars": null,
        "githubStarsDelta": null,
        "crossSourceCount": 1
      },
      "trendDelta": 1,
      "trendBaseline": 1,
      "previouslyFeatured": false,
      "clusterId": null,
      "clusterLabel": null
    },
    {
      "id": "b7d1e3ccac451e409d0ec9851ce1cd0ec1adf630",
      "title": "Microsoft event debuts new AI-friendly hardware and Windows changes",
      "source": "Ars Technica: AI",
      "sourceTier": 2,
      "url": "https://arstechnica.com/gadgets/2026/10/microsoft-event-debuts-new-ai-friendly-hardware-and-windows-changes/",
      "author": "Nick Indge",
      "publishedAt": "2026-10-08T00:00:24Z",
      "categoryHint": "News",
      "signals": {
        "hnPoints": null,
        "hnComments": null,
        "redditScore": null,
        "githubStars": null,
        "githubStarsDelta": null,
        "crossSourceCount": 1
      },
      "trendDelta": -2,
      "trendBaseline": 0,
      "previouslyFeatured": false,
      "clusterId": null,
      "clusterLabel": null
    }
  ]
}
