{
  "date": "2026-10-22",
  "batch": 5,
  "of": 5,
  "clusters": [],
  "items": [
    {
      "id": "2490444b7a3f7d64ea48ec2b60b3782261116da7",
      "title": "ServiceNow and Nvidia launch Arc, a new AI agent for enterprise",
      "source": "ZDNET: AI",
      "sourceTier": 2,
      "url": "https://www.zdnet.com/innovation/exclusive-servicenow-and-nvidia-launch-arc-a-new-ai-agent-for-enterprise/",
      "author": "Radhika Rajkumar",
      "publishedAt": "2026-10-21T11:30:00Z",
      "categoryHint": "News",
      "signals": {
        "hnPoints": null,
        "hnComments": null,
        "redditScore": null,
        "githubStars": null,
        "githubStarsDelta": null,
        "crossSourceCount": 1
      },
      "trendDelta": 1,
      "trendBaseline": 1,
      "previouslyFeatured": false,
      "clusterId": null,
      "clusterLabel": null
    },
    {
      "id": "d09eeb229d0d1286c1293f4b0fb8e097dd735cca",
      "title": "How to Build a Multi-Modal RAG Pipeline for Images and Documents in Python",
      "source": "Machine Learning Mastery",
      "sourceTier": 2,
      "url": "https://machinelearningmastery.com/how-to-build-a-multi-modal-rag-pipeline-for-images-and-documents-in-python/",
      "author": "Vinod Chugani",
      "publishedAt": "2026-10-21T11:00:00Z",
      "categoryHint": "Tutorials",
      "signals": {
        "hnPoints": null,
        "hnComments": null,
        "redditScore": null,
        "githubStars": null,
        "githubStarsDelta": null,
        "crossSourceCount": 1
      },
      "trendDelta": null,
      "trendBaseline": 0,
      "previouslyFeatured": false,
      "clusterId": null,
      "clusterLabel": null
    },
    {
      "id": "d4edec54662ef09a6e7ccbc00023a5fe5f98b676",
      "title": "I Built a Pipeline to Track the Job Market I'm Trying to Break Into.",
      "source": "Towards Data Science",
      "sourceTier": 2,
      "url": "https://towardsdatascience.com/i-built-a-pipeline-to-track-the-job-market-im-trying-to-break-into/",
      "author": "Ibrahim Salami",
      "publishedAt": "2026-10-21T11:00:00Z",
      "categoryHint": "Tutorials",
      "signals": {
        "hnPoints": null,
        "hnComments": null,
        "redditScore": null,
        "githubStars": null,
        "githubStarsDelta": null,
        "crossSourceCount": 1
      },
      "trendDelta": null,
      "trendBaseline": 0,
      "previouslyFeatured": false,
      "clusterId": null,
      "clusterLabel": null
    },
    {
      "id": "27ced8676a2635d4f780ae3cef4f9837d3e92193",
      "title": "AI for the Fortune 2000: How Tenex Builds an AI-Native SDLC — Alex Lieberman & CJ Hess",
      "source": "Latent Space",
      "sourceTier": 2,
      "url": "https://www.latent.space/p/tenex",
      "author": null,
      "publishedAt": "2026-10-21T05:01:26Z",
      "categoryHint": "News",
      "signals": {
        "hnPoints": null,
        "hnComments": null,
        "redditScore": null,
        "githubStars": null,
        "githubStarsDelta": null,
        "crossSourceCount": 1
      },
      "trendDelta": null,
      "trendBaseline": 0,
      "previouslyFeatured": false,
      "clusterId": null,
      "clusterLabel": null
    },
    {
      "id": "7ae337bb6e93b6bb94ab6a80017891c4e2d7ef23",
      "title": "Joel Kaplan leaves Meta",
      "source": "Platformer (Casey Newton)",
      "sourceTier": 2,
      "url": "https://www.platformer.news/meta-joel-kaplan-midterms-moderation/",
      "author": "Casey Newton",
      "publishedAt": "2026-10-21T01:34:35Z",
      "categoryHint": "News",
      "signals": {
        "hnPoints": null,
        "hnComments": null,
        "redditScore": null,
        "githubStars": null,
        "githubStarsDelta": null,
        "crossSourceCount": 1
      },
      "trendDelta": null,
      "trendBaseline": 0,
      "previouslyFeatured": false,
      "clusterId": null,
      "clusterLabel": null
    },
    {
      "id": "bea23034a697284d669d1f0aecf81a10c1cacec1",
      "title": "eMudhra Intermediate CA Compromise",
      "source": "Simon Willison",
      "sourceTier": 2,
      "url": "https://simonwillison.net/2026/Oct/20/emudhra-certificates/",
      "author": null,
      "publishedAt": "2026-10-20T23:50:25Z",
      "categoryHint": "Opinion",
      "signals": {
        "hnPoints": null,
        "hnComments": null,
        "redditScore": null,
        "githubStars": null,
        "githubStarsDelta": null,
        "crossSourceCount": 1
      },
      "trendDelta": 0.86,
      "trendBaseline": 1,
      "previouslyFeatured": false,
      "clusterId": null,
      "clusterLabel": null
    },
    {
      "id": "ec31e6fc5c0ba3934e701f7b8cad40feb6e2c5a0",
      "title": "Judge dismisses Sam Altman’s sister’s sexual abuse lawsuit",
      "source": "The Verge: AI",
      "sourceTier": 2,
      "url": "https://www.theverge.com/ai-artificial-intelligence/1014976/sam-altman-ann-altman-lawsuit-dismissed",
      "author": "Richard Lawler",
      "publishedAt": "2026-10-20T23:04:19Z",
      "categoryHint": "News",
      "signals": {
        "hnPoints": null,
        "hnComments": null,
        "redditScore": null,
        "githubStars": null,
        "githubStarsDelta": null,
        "crossSourceCount": 1
      },
      "trendDelta": 1,
      "trendBaseline": 1,
      "previouslyFeatured": false,
      "clusterId": null,
      "clusterLabel": null
    },
    {
      "id": "b5fc9ab399b1c375f7f1a489ef266a4e795b74c7",
      "title": "Anthropic Does Not Understand Why Its Draft Bill Was Unacceptable and Troubling",
      "source": "Don't Worry About the Vase (Zvi)",
      "sourceTier": 2,
      "url": "https://thezvi.substack.com/p/anthropic-does-not-understand-why",
      "author": "Zvi Mowshowitz",
      "publishedAt": "2026-10-20T23:03:05Z",
      "categoryHint": "Opinion",
      "signals": {
        "hnPoints": null,
        "hnComments": null,
        "redditScore": null,
        "githubStars": null,
        "githubStarsDelta": null,
        "crossSourceCount": 1
      },
      "trendDelta": null,
      "trendBaseline": 0,
      "previouslyFeatured": false,
      "clusterId": null,
      "clusterLabel": null
    },
    {
      "id": "5ed43860b2e69fceb1ed0656a310aaf5277732e9",
      "title": "Google’s more personalized Gemini AI is heading to your car",
      "source": "The Verge: AI",
      "sourceTier": 2,
      "url": "https://www.theverge.com/tech/1014999/google-gemini-ai-cars-android-auto",
      "author": "Emma Roth",
      "publishedAt": "2026-10-20T22:11:34Z",
      "categoryHint": "News",
      "signals": {
        "hnPoints": null,
        "hnComments": null,
        "redditScore": null,
        "githubStars": null,
        "githubStarsDelta": null,
        "crossSourceCount": 1
      },
      "trendDelta": 0.57,
      "trendBaseline": 1,
      "previouslyFeatured": false,
      "clusterId": null,
      "clusterLabel": null
    }
  ]
}
