{
  "date": "2026-10-12",
  "batch": 2,
  "of": 2,
  "clusters": [],
  "items": [
    {
      "id": "7d4e278f0b74844571bb3cf87efa87ac5316d15f",
      "title": "Will the HomeView be Apple’s first smart home success?",
      "source": "TechCrunch: AI",
      "sourceTier": 2,
      "url": "https://techcrunch.com/2026/10/11/will-the-homeview-be-apples-first-smart-home-success/",
      "author": "Anthony Ha",
      "publishedAt": "2026-10-11T21:14:40Z",
      "categoryHint": "Business",
      "signals": {
        "hnPoints": null,
        "hnComments": null,
        "redditScore": null,
        "githubStars": null,
        "githubStarsDelta": null,
        "crossSourceCount": 1
      },
      "trendDelta": 1,
      "trendBaseline": 1,
      "previouslyFeatured": false,
      "clusterId": null,
      "clusterLabel": null
    },
    {
      "id": "8d1b5970f0e4c138f22740a6fb37cfd78cddfe2e",
      "title": "48 hours to TechCrunch Disrupt 2026 — hear directly from the people building what’s next",
      "source": "TechCrunch: AI",
      "sourceTier": 2,
      "url": "https://techcrunch.com/2026/10/11/48-hours-to-techcrunch-disrupt-2026-hear-directly-from-the-people-building-whats-next/",
      "author": "TechCrunch Events",
      "publishedAt": "2026-10-11T19:00:00Z",
      "categoryHint": "Business",
      "signals": {
        "hnPoints": null,
        "hnComments": null,
        "redditScore": null,
        "githubStars": null,
        "githubStarsDelta": null,
        "crossSourceCount": 1
      },
      "trendDelta": 1,
      "trendBaseline": 1,
      "previouslyFeatured": false,
      "clusterId": null,
      "clusterLabel": null
    },
    {
      "id": "48092d1d873f6f9c42aa9c42dc05a08e7b872729",
      "title": "Silicon Valley is falling in line with Trump’s attempt to rename AI",
      "source": "The Verge: AI",
      "sourceTier": 2,
      "url": "https://www.theverge.com/ai-artificial-intelligence/1009406/silicon-valley-is-falling-in-line-with-trumps-attempt-to-rename-ai",
      "author": "Terrence O’Brien",
      "publishedAt": "2026-10-11T18:33:56Z",
      "categoryHint": "News",
      "signals": {
        "hnPoints": null,
        "hnComments": null,
        "redditScore": null,
        "githubStars": null,
        "githubStarsDelta": null,
        "crossSourceCount": 1
      },
      "trendDelta": 1,
      "trendBaseline": 1,
      "previouslyFeatured": false,
      "clusterId": null,
      "clusterLabel": null
    },
    {
      "id": "df97c62cc773ca8681dae7e4956554b91d53bcca",
      "title": "Can the AI industry persuade data center opponents by getting rid of NDAs?",
      "source": "TechCrunch: AI",
      "sourceTier": 2,
      "url": "https://techcrunch.com/2026/10/11/can-the-ai-industry-persuade-data-center-opponents-by-getting-rid-of-ndas/",
      "author": "Anthony Ha",
      "publishedAt": "2026-10-11T16:52:33Z",
      "categoryHint": "Business",
      "signals": {
        "hnPoints": null,
        "hnComments": null,
        "redditScore": null,
        "githubStars": null,
        "githubStarsDelta": null,
        "crossSourceCount": 1
      },
      "trendDelta": null,
      "trendBaseline": 0,
      "previouslyFeatured": false,
      "clusterId": null,
      "clusterLabel": null
    },
    {
      "id": "778ab122b6ef9260b6e465550fb532d73d5724a8",
      "title": "These execs think voice AI hasn’t reached its ChatGPT moment yet",
      "source": "TechCrunch: AI",
      "sourceTier": 2,
      "url": "https://techcrunch.com/2026/10/11/these-execs-think-voice-ai-hasnt-reached-its-chatgpt-moment-yet/",
      "author": "Ivan Mehta",
      "publishedAt": "2026-10-11T14:00:00Z",
      "categoryHint": "Business",
      "signals": {
        "hnPoints": null,
        "hnComments": null,
        "redditScore": null,
        "githubStars": null,
        "githubStarsDelta": null,
        "crossSourceCount": 1
      },
      "trendDelta": null,
      "trendBaseline": 0,
      "previouslyFeatured": false,
      "clusterId": null,
      "clusterLabel": null
    },
    {
      "id": "ee92128ac4624f395088f69c897a80bf4769e6ce",
      "title": "A Practical Guide to OpenAI's New Decisions API",
      "source": "Towards Data Science",
      "sourceTier": 2,
      "url": "https://towardsdatascience.com/a-practical-guide-to-openais-new-decisions-api/",
      "author": "Thomas Reid",
      "publishedAt": "2026-10-11T14:00:00Z",
      "categoryHint": "Tutorials",
      "signals": {
        "hnPoints": null,
        "hnComments": null,
        "redditScore": null,
        "githubStars": null,
        "githubStarsDelta": null,
        "crossSourceCount": 1
      },
      "trendDelta": null,
      "trendBaseline": 0,
      "previouslyFeatured": false,
      "clusterId": null,
      "clusterLabel": null
    },
    {
      "id": "738bfae7f3b8a61f71cd81cb689774b0f4082f94",
      "title": "Hark the Herald Agent, Claude Gets Its Docs in a Row, and OpenAI’s Sign of the Times",
      "source": "The Signal",
      "sourceTier": 2,
      "url": "https://thesignal.substack.com/p/hark-the-herald-agent-claude-gets",
      "author": "Alex Banks",
      "publishedAt": "2026-10-11T13:03:52Z",
      "categoryHint": "News",
      "signals": {
        "hnPoints": null,
        "hnComments": null,
        "redditScore": null,
        "githubStars": null,
        "githubStarsDelta": null,
        "crossSourceCount": 1
      },
      "trendDelta": 0.75,
      "trendBaseline": 1,
      "previouslyFeatured": false,
      "clusterId": null,
      "clusterLabel": null
    },
    {
      "id": "31276c3a3106709ff201b1dae1afa5f80494fdac",
      "title": "Agentic Systems: A Practitioner's Guide to 6 Advanced Architectural Patterns",
      "source": "Towards Data Science",
      "sourceTier": 2,
      "url": "https://towardsdatascience.com/agentic-systems-a-practitioners-guide-to-6-advanced-architectural-patterns/",
      "author": "Partha Sarkar",
      "publishedAt": "2026-10-11T12:00:00Z",
      "categoryHint": "Tutorials",
      "signals": {
        "hnPoints": null,
        "hnComments": null,
        "redditScore": null,
        "githubStars": null,
        "githubStarsDelta": null,
        "crossSourceCount": 1
      },
      "trendDelta": null,
      "trendBaseline": 0,
      "previouslyFeatured": false,
      "clusterId": null,
      "clusterLabel": null
    },
    {
      "id": "0b1518dc9b60572e714097df4b5561081239201f",
      "title": "I Made Terrible Games With Google’s AI Playground",
      "source": "WIRED: AI",
      "sourceTier": 2,
      "url": "https://www.wired.com/story/i-made-terrible-games-with-googles-ai-playground/",
      "author": "Boone Ashworth",
      "publishedAt": "2026-10-11T11:30:00Z",
      "categoryHint": "News",
      "signals": {
        "hnPoints": null,
        "hnComments": null,
        "redditScore": null,
        "githubStars": null,
        "githubStarsDelta": null,
        "crossSourceCount": 1
      },
      "trendDelta": null,
      "trendBaseline": 0,
      "previouslyFeatured": false,
      "clusterId": null,
      "clusterLabel": null
    },
    {
      "id": "f379902df709de45f86c62279dbd81718e4fd7d8",
      "title": "Learning to use local AI is exciting, overwhelming, and frustrating",
      "source": "The Verge: AI",
      "sourceTier": 2,
      "url": "https://www.theverge.com/ai-artificial-intelligence/1008484/learning-local-ai-hermes-qwen-model-mac-studio-testing-diary-progress",
      "author": "Antonio G. Di Benedetto",
      "publishedAt": "2026-10-11T11:00:00Z",
      "categoryHint": "News",
      "signals": {
        "hnPoints": null,
        "hnComments": null,
        "redditScore": null,
        "githubStars": null,
        "githubStarsDelta": null,
        "crossSourceCount": 1
      },
      "trendDelta": null,
      "trendBaseline": 0,
      "previouslyFeatured": false,
      "clusterId": null,
      "clusterLabel": null
    },
    {
      "id": "e179bee0d893481bcfc17c48c80fb335dd055c05",
      "title": "Dwarf Fortress uses version control now",
      "source": "Simon Willison",
      "sourceTier": 2,
      "url": "https://simonwillison.net/2026/Oct/11/dwarf-fortress/",
      "author": null,
      "publishedAt": "2026-10-11T00:52:37Z",
      "categoryHint": "Opinion",
      "signals": {
        "hnPoints": null,
        "hnComments": null,
        "redditScore": null,
        "githubStars": null,
        "githubStarsDelta": null,
        "crossSourceCount": 1
      },
      "trendDelta": null,
      "trendBaseline": 0,
      "previouslyFeatured": false,
      "clusterId": null,
      "clusterLabel": null
    },
    {
      "id": "24d721d473226f250d79781b08605fb05b8f9291",
      "title": "Python 3.15.0 added to actions/python-versions",
      "source": "Simon Willison",
      "sourceTier": 2,
      "url": "https://simonwillison.net/2026/Oct/10/python-actions/",
      "author": null,
      "publishedAt": "2026-10-10T23:58:04Z",
      "categoryHint": "Opinion",
      "signals": {
        "hnPoints": null,
        "hnComments": null,
        "redditScore": null,
        "githubStars": null,
        "githubStarsDelta": null,
        "crossSourceCount": 1
      },
      "trendDelta": null,
      "trendBaseline": 0,
      "previouslyFeatured": false,
      "clusterId": null,
      "clusterLabel": null
    }
  ]
}
